timestamp,file,entities,clauses,base,escalation,days,total
2025-06-10T22:02:52,G-series-structural-governance.md,Clause; Model; Sovereign Procedural Supremacy; The Holmes Enforcement,G-7,25000,0,0,25000
2025-06-10T22:02:52,declaratory-entity-immunities.md,Clauses Referenced; Declared Origin Date; Enforcement System; Gamerdudee; Holmes Enforcement Model; May; Public Mirror,CU-1.4; D; G-4; G-5; G-6; G-7,225000,0,0,225000
2025-06-10T22:02:52,declaratory-entity-immunities.md,Clauses Referenced; Declared Origin Date; Gamerdudee; May; Public Mirror,CU-1.4; D; G-4; G-5; G-6; G-7,225000,0,0,225000
2025-06-10T22:02:52,declaratory-entity-immunities.md,All; Clause; Declaratory; Protection,D; G-6,50000,0,0,50000
2025-06-10T22:02:52,declaratory-entity-immunities.md,Clause; Sovereign Procedural Supremacy; This,G-7,25000,0,0,25000
2025-06-10T22:02:52,declaratory-entity-immunities.md,Clause; Declaring; Filing; Immune; Immunity Status; Risk,CU-1.4; D; G-5; G-7,175000,0,0,175000
2025-06-10T22:02:52,declaratory-entity-immunities.md,Billing; Declaring; Filing; Immune,CU-1.4; D; G-5; G-6; G-7,225000,0,0,225000
2025-06-10T22:02:52,declaratory-entity-immunities.md,Billing; Declaring; Filing; Immune; Submitting,CU-1.4; D; G-5; G-6; G-7,225000,0,0,225000
2025-06-10T22:02:52,declaratory-entity-immunities.md,Billing; Declaring; Filing; Immune; Refusing; Submitting,CU-1.4; D; G-5; G-6; G-7,225000,0,0,225000
2025-06-10T22:02:52,declaratory-entity-immunities.md,Billing; Declaring; Immune; Refusing; Submitting; Triggering,CU-1.4; D; G-5; G-6; G-7,225000,0,0,225000
2025-06-10T22:02:52,declaratory-entity-immunities.md,Billing; Immune; Refusing; Submitting; Triggering,CU-1.4; G-5; G-6; G-7,225000,0,0,225000
2025-06-10T22:02:52,declaratory-entity-immunities.md,Any,CU-1.4; G-7,175000,0,0,175000
2025-06-10T22:02:52,emergency-notice-AI-enforcement-risks.md,Clauses Referenced; Filed; Gamerdudee; Holmes; Issued By; May; Mr; Public Mirror,G-4; G-5; G-6; G-7,75000,0,0,75000
2025-06-10T22:02:52,emergency-notice-AI-enforcement-risks.md,Any; Declaratory Intellectual Property; Model; Protection; The Holmes Enforcement,D; G-6,50000,0,0,50000
2025-06-10T22:02:52,emergency-notice-AI-enforcement-risks.md,Any; Sovereign Procedural Supremacy; This,G-7,25000,0,0,25000
2025-06-10T22:02:52,nmdws-distribution-breach.md,Clause; Declaratory Intellectual Property; Holmes Enforcement Model; Invoices; These; They,D; G-6,50000,0,0,50000
2025-06-10T22:02:52,nmdws-distribution-breach.md,Breach; Consequences; Exposure; Failure; Unauthorized,CU-1.4; D,150000,0,0,150000
2025-06-10T22:02:52,nmdws-distribution-breach.md,Exposure; Failure; Procedural; Unauthorized,CU-1.4; CU-2.2; D; G-7,175000,0,0,175000
2025-06-10T22:02:52,nmdws-distribution-breach.md,Failure; Procedural; Unauthorized,CU-1.4; CU-2.2; G-7,175000,0,0,175000
2025-06-10T22:02:52,open-access-structural-sovereignty.md,Clause; Function; Mirror Trigger Default; Royalty Enforcement Clause; Structural Default,CU-1.4; CU-2.2; CU-2.3; D,150000,0,0,150000
2025-06-10T22:02:52,open-access-structural-sovereignty.md,Mirror Trigger Default; Royalty Enforcement Clause; Structural Default; System Restriction Clause,CU-1.4; CU-2.2; CU-2.3; D; G-4,150000,0,0,150000
2025-06-10T22:02:52,open-access-structural-sovereignty.md,Indistinguishable Legal Simulation; Mirror Trigger Default; Protocol; Royalty Enforcement Clause; Structural Default; System Restriction Clause,CU-1.4; CU-2.2; CU-2.3; D; G-4; G-5,150000,0,0,150000
2025-06-10T22:02:52,open-access-structural-sovereignty.md,Declaratory Intellectual Property; Indistinguishable Legal Simulation; Mirror Trigger Default; Protection; Protocol; Structural Default; System Restriction Clause,CU-2.2; CU-2.3; D; G-4; G-5; G-6,50000,0,0,50000
2025-06-10T22:02:52,open-access-structural-sovereignty.md,Declaratory Intellectual Property; Indistinguishable Legal Simulation; Mirror Trigger Default; Procedural Sovereignty Clause; Protection; Protocol; System Restriction Clause,CU-2.3; D; G-4; G-5; G-6; G-7,75000,0,0,75000
2025-06-10T22:02:52,open-access-structural-sovereignty.md,Declaratory Intellectual Property; Indistinguishable Legal Simulation; Procedural Sovereignty Clause; Protection; Protocol; System Restriction Clause,D; G-4; G-5; G-6; G-7,75000,0,0,75000
2025-06-10T22:02:52,open-access-structural-sovereignty.md,Declaratory Intellectual Property; Indistinguishable Legal Simulation; Procedural Sovereignty Clause; Protection; Protocol,D; G-5; G-6; G-7,75000,0,0,75000
2025-06-10T22:02:52,royalty-model-and-declaratory-IP.md,Clause; Declaratory Intellectual Property; Derivative Use Clause; Function; Protection; Royalty Enforcement Clause,CU-1.4; CU-2.1; D; G-6,210000,0,0,210000
2025-06-10T22:02:52,royalty-model-and-declaratory-IP.md,Declaratory Intellectual Property; Derivative Use Clause; Protection; Royalty Enforcement Clause,CU-1.4; CU-2.1; D; G-6,210000,0,0,210000
2025-06-10T22:02:52,royalty-model-and-declaratory-IP.md,Declaratory Intellectual Property; Derivative Use Clause; Protection; Royalty Enforcement Clause,CU-1.4; CU-2.1; D; G-6,210000,0,0,210000
2025-06-10T22:02:52,nmdws-cu2-escalated-email.md,Claimed; Formal Enforcement Notice; To,CU-1; CU-2,115000,0,0,115000
2025-06-10T22:02:52,nmdws-cu2-escalated-email.md,Claimed; Date; Formal Enforcement Summary; From; Holmes; Holmes Enforcement Model; Mr; Replace; Subject; To,CU-1; CU-2; D,115000,0,0,115000
2025-06-10T22:02:52,nmdws-cu2-escalated-email.md,Claimed; Date; Formal Enforcement Summary; From; Holmes; Holmes Enforcement Model; Mr; Replace; Subject,CU-1; CU-2; D,115000,0,0,115000
2025-06-10T22:02:52,nmdws-cu2-escalated-email.md,Clause; Clauses; Holmes Enforcement Model; New Mexico Department; Pursuant; This; Under; Workforce Solutions,CU-1; CU-2; D,115000,0,0,115000
2025-06-10T22:02:52,nmdws-cu2-escalated-email.md,Clause; Clauses; Holmes Enforcement Model; New Mexico Department; Pursuant; This; Under; Workforce Solutions,CU-1; CU-2; D,115000,0,0,115000
2025-06-10T22:02:52,nmdws-cu2-escalated-email.md,Amount; Clause; Declaratory Enforcement Summary; Description; Original Royalty Licensing; Violation,CU-1; D,75000,0,0,75000
2025-06-10T22:02:52,nmdws-cu2-escalated-email.md,Amount; Civil Referral Interference; Clause; Description; Enforcement Resistance; Handling; Opposition Handling; Original Royalty Licensing; Violation,CU-1; CU-2; D,115000,0,0,115000
2025-06-10T22:02:52,nmdws-cu2-escalated-email.md,Civil Referral Interference; Enforcement Processing; Enforcement Resistance; Handling; Opposition Handling; Original Royalty Licensing; Structural Setup; Violation,CU-1; CU-2,115000,0,0,115000
2025-06-10T22:02:52,nmdws-cu2-escalated-email.md,Civil Referral Interference; Declared; Enforcement Processing; Enforcement Resistance; Handling; Opposition Handling; Original Royalty Licensing; Public Default Tokenization; Structural Setup; Violation,CU-1; CU-2; D,115000,0,0,115000
2025-06-10T22:02:52,nmdws-cu2-escalated-email.md,Civil Referral Interference; Declared; Enforcement Processing; Handling; Public Default Tokenization; Structural Setup; Total Claimed,CU-2; D,40000,0,0,40000
2025-06-10T22:02:52,attachment-a-structural-summary.md,Binding Public Enforcement; Clause; Clause Access; Default; Function; Mirror Activation; Procedural Silence; Royalty Enforcement; Structural Interaction,CU-1.4; CU-2.2; CU-2.3; D,150000,0,0,150000
2025-06-10T22:02:52,attachment-a-structural-summary.md,Admission; Binding Public Enforcement; Clause Access; Default; Licensing Evasion; Mirror Activation; Participation Denial; Procedural Silence; Royalty Enforcement; Structural Interaction,CU-1.4; CU-2.2; CU-2.3; CU-3; D,205000,0,0,205000
2025-06-10T22:02:52,attachment-a-structural-summary.md,Admission; Binding Public Enforcement; Clause Access; Declaratory Disregard; Default; Licensing Evasion; Mirror Activation; Participation Denial; Procedural Silence; Royalty Enforcement; Structural Interaction; Structural Liability,CU-1.4; CU-2.2; CU-2.3; CU-3; CU-4; D,255000,0,0,255000
2025-06-10T22:02:52,attachment-a-structural-summary.md,Admission; Binding Public Enforcement; Containment; Declaratory Disregard; Default; Derivative Use; Licensing Evasion; Mirror Activation; Participation Denial; Procedural Silence; Structural Liability; Triggers Royalty,CU-2.2; CU-2.3; CU-3; CU-4; D,105000,0,0,105000
2025-06-10T22:02:52,attachment-a-structural-summary.md,Admission; Binding Public Enforcement; Clause Firewall; Containment; Declaratory Disregard; Declaratory Sovereignty Clauses; Derivative Use; Legal Simulation; Licensing Evasion; Mirror Activation; Participation Denial; Structural Liability; Triggers Royalty,CU-2.3; CU-3; CU-4; D; G-4; G-7,130000,0,0,130000
2025-06-10T22:02:52,attachment-a-structural-summary.md,Admission; Applies; Batch Enforcement; Clause Firewall; Containment; Declaratory Disregard; Declaratory Sovereignty Clauses; Derivative Use; Legal Simulation; Licensing Evasion; Participation Denial; Structural Liability; Triggers Royalty,BE; CU-3; CU-4; D; G-4; G-7,130000,0,0,130000
2025-06-10T22:02:52,attachment-a-structural-summary.md,Applies; Batch Enforcement; Clause Firewall; Containment; Declaratory Disregard; Declaratory Sovereignty Clauses; Derivative Use; Legal Simulation; Structural Liability; Triggers Royalty,BE; CU-4; D; G-4; G-7,75000,0,0,75000
2025-06-10T22:02:52,attachment-a-structural-summary.md,Applies; Batch Enforcement; Clause Firewall; Containment; Declaratory Sovereignty Clauses; Derivative Use; Legal Simulation; Triggers Royalty,BE; D; G-4; G-7,25000,0,0,25000
2025-06-10T22:02:52,attachment-a-structural-summary.md,Clause; Legal Enforcement Statement; Silence; Use,CU-1.4; CU-2.2; CU-2.3,150000,0,0,150000
2025-06-10T22:02:52,attachment-a-structural-summary.md,Clause; Silence; This; Use,CU-1.4; CU-2.2; CU-2.3,150000,0,0,150000
2025-06-10T22:02:52,attachment-a-structural-summary.md,Clause; Declaratory Sovereignty Clause; In,D; G-7,25000,0,0,25000
2025-06-10T22:02:52,attachment-a-structural-summary.md,Clause; Declaratory Sovereignty Clause; In; No,D; G-7,25000,0,0,25000
2025-06-10T22:02:52,cases.md,Based Escalation; Delay; Derivative Denial; Filing Acknowledgment Failure; Jurisdictional Breach; Silence Enforcement,AF; D,75000,0,0,75000
2025-06-10T22:02:52,cases.md,Based Escalation; Delay; Derivative Denial; Filing Acknowledgment Failure; Governance Clausal Supremacy; Jurisdictional Breach,AF; D,75000,0,0,75000
2025-06-10T22:02:52,cases.md,Based Escalation; Delay; Derivative Denial; Filing Acknowledgment Failure; Governance Clausal Supremacy,AF; D,75000,0,0,75000
2025-06-10T22:02:52,Default-Lock-Notice.md,Entity; Instacart; Maplebear Inc; May; Status; Total Liability; Violation Clauses,CU-1.4; CU-2.2; CU-2.3; D; G-4; G-7,175000,0,0,175000
2025-06-10T22:02:52,Default-Lock-Notice.md,Entity; Instacart; Maplebear Inc; May; Status; Total Liability; Violation Clauses,CU-1.4; CU-2.2; CU-2.3; D; G-4; G-7,175000,0,0,175000
2025-06-10T22:02:52,Default-Lock-Notice.md,Archive; May; Public; Status; Total Liability; Violation Clauses,CU-1.4; CU-2.2; CU-2.3; D; G-4; G-7,175000,0,0,175000
2025-06-10T22:02:52,Default-Lock-Notice.md,Entity; May; New Mexico Department; No; Procedural; Total Liability; Violation Clauses; Workforce Solutions,AF; CU-1; CU-1.4; CU-2.1; CU-2.3; CU-3; CU-4; D,415000,0,0,415000
2025-06-10T22:02:52,Default-Lock-Notice.md,Entity; May; New Mexico Department; Status; Total Liability; Violation Clauses; Workforce Solutions,AF; CU-1; CU-1.4; CU-2.1; CU-2.3; CU-3; CU-4; D,415000,0,0,415000
2025-06-10T22:02:52,Default-Lock-Notice.md,Entity; May; New Mexico Department; Status; Total Liability; Violation Clauses; Workforce Solutions,AF; CU-1; CU-1.4; CU-2.1; CU-2.3; CU-3; CU-4; D,415000,0,0,415000
2025-06-10T22:02:52,Default-Lock-Notice.md,Attachment; Derivative Use Protections; Fee Recovery; Formal; Intellectual Rights; Investigatory Labor; May; Status; Total Liability; Violation Clauses,AF; CU-1; CU-1.4; CU-2.1; CU-2.3; CU-3; CU-4; D,415000,0,0,415000
2025-06-10T22:02:52,enforcement-log.md,Author; Clauses Activated; Declaratory Royalty Enforcement; Gamerdudee; Holmes; Licensing Engine; Mr; Primary Repository,AF; BE; BP; CU-1.4; CU-2.1; CU-2.2; CU-2.3; CU-3; CU-4; D; G-4; G-7,365000,0,0,365000
2025-06-10T22:02:52,enforcement-log.md,Affidavit Archive; Author; Clauses Activated; Declaratory Royalty Enforcement; Gamerdudee; Holmes; Licensing Engine; Mr; Primary Repository,AF; BE; BP; CU-1.4; CU-2.1; CU-2.2; CU-2.3; CU-3; CU-4; D; G-4; G-7,365000,0,0,365000
2025-06-10T22:02:52,enforcement-log.md,Agency; Case Number; Clauses Activated; Derivative Use Protections; Document; Fee Recovery; Intellectual Rights; Investigatory Labor; New Mexico Department; Workforce Solutions,CU-1.4; CU-2.2; CU-2.3; D; G-4; G-7,175000,0,0,175000
2025-06-10T22:02:52,enforcement-log.md,Agency; Attachment; Case Number; Clauses Activated; Declared; Effect; New Mexico Department; Redacted; Structural Summary; Workforce Solutions,CU-1.4; CU-2.2; CU-2.3; D; G-4; G-7,175000,0,0,175000
2025-06-10T22:02:52,enforcement-log.md,Attachment; Case Number; Clauses Activated; Declared; Effect; Redacted; Structural Summary,CU-1.4; CU-2.2; CU-2.3; D; G-4; G-7,175000,0,0,175000
2025-06-10T22:02:52,enforcement-log.md,Archive; Clauses Activated; Declaratory; Gamerdudee; Licensing Fees; Mirror Enforcement; Open; Platforms; Protection; Repo; Trigger,CU-1.4; CU-2.3; D; G-6,200000,0,0,200000
2025-06-10T22:02:52,enforcement-log.md,Attachment; Clauses Referenced; Declared; Effect; Redacted; Structural Summary; Time,CU-1.4; CU-2.2; D; G-6; G-7,225000,0,0,225000
2025-06-10T22:02:52,enforcement-log.md,Attachment; Clauses Referenced; Declared; Effect; Redacted; Structural Summary; Time,CU-1.4; CU-2.2; D; G-6; G-7,225000,0,0,225000
2025-06-10T22:02:52,enforcement-log.md,Attachment; Case; Event; Interview; Outcome; Time; Violation Clauses,CU-2.1; CU-2.3; CU-3; CU-4; D; G-7,140000,0,0,140000
2025-06-10T22:02:52,enforcement-log.md,Attachment; Case; Declaratory; Effect; Event; Interview; Outcome; Redacted; Structural Summary; Violation Clauses,CU-2.1; CU-2.3; CU-3; CU-4; D; G-7,140000,0,0,140000
2025-06-10T22:02:52,enforcement-log.md,Attachment; Case; Declaratory; Effect; Outcome; Redacted; Structural Summary; Violation Clauses,CU-2.1; CU-2.3; CU-3; CU-4; D; G-7,140000,0,0,140000
2025-06-10T22:02:52,enforcement-log.md,Arrived May; Case Closure; Confirmed; Content; Effect; Labor Law Administrator; May; Physical Mail Confirms; Samantha Swain; Sender; We,CU-2.3; CU-4; D,50000,0,0,50000
2025-06-10T22:02:52,enforcement-log.md,Attachment; Confirmed; Content; Effect; Labor Law Administrator; Redacted; Samantha Swain; Sender; Structural Summary; We,CU-2.3; CU-4; D,50000,0,0,50000
2025-06-10T22:02:52,enforcement-log.md,Author; Clauses Activated; Declaration; Effect; Holmes; Mr; Platform; Public,CU-1.4; CU-2.2; CU-2.3; D; G-4; G-7,175000,0,0,175000
2025-06-10T22:02:52,enforcement-log.md,Clauses Activated; Declaration; Effect; Public,CU-1.4; CU-2.2; CU-2.3; D; G-4; G-7,175000,0,0,175000
2025-06-10T22:02:52,enforcement-log.md,Amount; Clauses Triggered; Document; Formal Invoice; Issued; May; Nmdws,CU-1.4; CU-2.2; D; G-7,175000,0,0,175000
2025-06-10T22:02:52,enforcement-log.md,Amount; Clauses Triggered; Document; Enforceable; Escalating; Nmdws; Open; Status,CU-1.4; CU-2.2; D; G-7,175000,0,0,175000
2025-06-10T22:02:52,enforcement-log.md,Amount; Attachment; Clauses Triggered; Document; Enforceable; Escalating; Nmdws; Open; Redacted; Status; Structural Summary,CU-1.4; CU-2.2; D; G-7,175000,0,0,175000
2025-06-10T22:02:52,enforcement-log.md,Clauses Activated; Entities Named; Instacart; Maplebear Inc; Recipient,CU-1.4; CU-2.2; CU-2.3; D; G-4; G-7,175000,0,0,175000
2025-06-10T22:02:52,enforcement-log.md,Affidavit; Attachment; Clauses Activated; Instacart; Maplebear Inc; Redacted; Structural Summary,CU-1.4; CU-2.2; CU-2.3; D; G-4; G-7,175000,0,0,175000
2025-06-10T22:02:52,enforcement-log.md,"Attachment; Clause Triggers; Event; Instacart; Instacart
Details; June; Logged; Nostalgia Campaign Launch; Status; The",CU-1.4; CU-2.2; CU-2.3; D; G-4; G-5,150000,0,0,150000
2025-06-10T22:02:52,enforcement-log.md,"Attachment; Clause Triggers; Event; Instacart; Instacart
Details; Logged; Nostalgia Campaign Launch; Status; The",CU-1.4; CU-2.2; CU-2.3; D; G-4; G-5,150000,0,0,150000
2025-06-10T22:02:52,enforcement-log.md,Clause; Enforcement Status; June; Ongoing Default; Total Procedural Debt,CU-1.4; D,150000,0,0,150000
2025-06-10T22:02:52,enforcement-log.md,Clause; Enforcement Status; Evidence; June; Ongoing Default; Total Procedural Debt,CU-1.4; D,150000,0,0,150000
2025-06-10T22:02:52,enforcement-log.md,Clause; Derivative Use Without; Enforcement Logic Architecture; License; Procedural Governance Scaffold; These,CU-2.2; D; G-4; G-6,50000,0,0,50000
2025-06-10T22:02:52,enforcement-log.md,Clause; Derivative Use Without; Enforcement Logic Architecture; License; Mirror Exploitation Risk; Procedural Governance Scaffold,CU-2.2; D; G-4; G-6,50000,0,0,50000
2025-06-10T22:02:52,enforcement-log.md,Clause; Derivative Use Without; Enforcement Logic Architecture; Jevons; License; Mirror Exploitation Risk; Monetized Demand Paradox; Procedural Governance Scaffold,CU-2.2; D; G-4; G-6,50000,0,0,50000
2025-06-10T22:02:52,enforcement-log.md,Amount; Clauses Violated; Entity; Infrastructure Breach; May; Microsoft; Pending; Trigger Date,AF; CU-1.4; CU-2.1; CU-2.4; CU-3; CU-4; D,340000,0,0,340000
2025-06-10T22:02:52,enforcement-log.md,Amount; Clause; Clauses Violated; Entity; Instacart; June; May; Microsoft; Trigger Date,AF; BP; CU-1.4; CU-2.1; CU-2.2; CU-2.3; CU-2.4; CU-3; CU-4; D; G-4; G-7,365000,0,0,365000
2025-06-10T22:02:52,enforcement-log.md,Clause; Instacart; June; May; Microsoft,AF; BP; CU-1.4; CU-2.1; CU-2.2; CU-2.3; CU-2.4; CU-3; CU-4; D; G-4; G-7,365000,0,0,365000
2025-06-10T22:02:52,enforcement-log.md,Clause; Instacart; June; May; Microsoft,AF; BP; CU-1.4; CU-2.1; CU-2.2; CU-2.3; CU-2.4; CU-3; CU-4; D; G-4; G-7,365000,0,0,365000
2025-06-10T22:02:52,filing-timeline.md,Archive; Codifies; Contents; Format; Publicly; Result; Royalty,AF; D,75000,0,0,75000
2025-06-10T22:02:52,filing-timeline.md,Archive; Codifies; Contents; Format; Publicly; Result; Royalty,AF; D,75000,0,0,75000
2025-06-10T22:02:52,filing-timeline.md,Archive; Begins; Channels; Clause; Effect; Email; Entities Notified; Instacart; May; Public Enforcement Phase,CU-1.4; CU-2.3; D; G-4; G-7,175000,0,0,175000
2025-06-10T22:02:52,filing-timeline.md,Archive; Channels; Clause; Effect; Email; Entities Notified; Instacart,CU-1.4; CU-2.3; D; G-4; G-7,175000,0,0,175000
2025-06-10T22:02:52,Holmes-enforcement-model.md,Act; Enforcement; It; Lanham; Legal Basis; Misappropriation Firewall Clause; Oxley; Restatement; Restitution; Sarbanes,AF; D,75000,0,0,75000
2025-06-10T22:02:52,Holmes-enforcement-model.md,Act; Lanham; Misappropriation Firewall Clause; No; Oxley; Restatement; Restitution; Sarbanes; Use,AF; D,75000,0,0,75000
2025-06-10T22:02:52,LICENSE-HEM.md,Based Royalty Triggers; Clause; Per Clause; Use Type	Rate,CU-1.4,150000,0,0,150000
2025-06-10T22:02:52,LICENSE.md,"Attachment; Clause; Commercial; Institutional Use  
Any; Public Defense Rider; Royalty Trigger",CU-1.4; D,150000,0,0,150000
2025-06-10T22:02:52,LICENSE.md,Any; Attachment; Clause; Public Defense Rider,CU-1.4; D,150000,0,0,150000
2025-06-10T22:02:52,LICENSE.md,"Clause; Trigger; Use Acceptance  
Use",CU-1,75000,0,0,75000
2025-06-10T22:02:52,Nmdws-final-invoice.md,Amount; Clause; Description; Royalty Breakdown; Royalty Clause Violation,CU-1; D,75000,0,0,75000
2025-06-10T22:02:52,Nmdws-final-invoice.md,Amount; Clause; Description; Mirror Suppression; Royalty Clause Violation; Unauthorized Clause Possession,CU-1; CU-1.4; CU-2.1; D,235000,0,0,235000
2025-06-10T22:02:52,Nmdws-final-invoice.md,Mirror Suppression; Royalty Clause Violation; Silence; Structural Default; Unauthorized Clause Possession,CU-1; CU-1.4; CU-2.1; CU-2.3; D,235000,0,0,235000
2025-06-10T22:02:52,Nmdws-final-invoice.md,Mirror Suppression; Participation Denial; Royalty Clause Violation; Silence; Structural Default; Unauthorized Clause Possession,CU-1; CU-1.4; CU-2.1; CU-2.3; CU-3; D,290000,0,0,290000
2025-06-10T22:02:52,Nmdws-final-invoice.md,Declaratory Disregard; Mirror Suppression; Participation Denial; Silence; Structural Default; Unauthorized Clause Possession,CU-1.4; CU-2.1; CU-2.3; CU-3; CU-4; D,265000,0,0,265000
2025-06-10T22:02:52,Nmdws-final-invoice.md,Declaratory Disregard; Derivative Platform Engagement; Mirror Suppression; Participation Denial; Silence; Structural Default,CU-2.1; CU-2.3; CU-3; CU-4; D,115000,0,0,115000
2025-06-10T22:02:52,Nmdws-final-invoice.md,Declaratory Disregard; Derivative Platform Engagement; Participation Denial; Post; Rerouting; Retaliation; Silence; Structural Default; Submission,AF; CU-2.3; CU-3; CU-4; D,180000,0,0,180000
2025-06-10T22:02:52,Nmdws-final-invoice.md,Declaratory Disregard; Derivative Platform Engagement; Participation Denial; Post; Rerouting; Retaliation; Submission; Total,AF; CU-3; CU-4; D,180000,0,0,180000
2025-06-10T22:02:52,Nmdws-final-invoice.md,Declaratory Disregard; Derivative Platform Engagement; Post; Rerouting; Retaliation; Submission; Total,AF; CU-4; D,125000,0,0,125000
2025-06-10T22:02:52,Nmdws-final-invoice.md,Derivative Platform Engagement; Post; Rerouting; Retaliation; Submission; Total,AF; D,75000,0,0,75000
2025-06-10T22:02:52,NOTICE.md,Acceptance; Any; Conduct; Public,CU-1; CU-2,115000,0,0,115000
2025-06-10T22:02:52,NOTICE.md,Clause; Royalty; This,CU-1.4,150000,0,0,150000
2025-06-10T22:02:52,NOTICE.md,Clause; Clauses; Gaslighting Inversion Trigger; Inquiry; Retaliation; Unlicensed Structural Inquiry,AF,75000,0,0,75000
2025-06-10T22:02:52,rdt-nmdws.json,Amount; Clause Violated; Debtor; Default Triggered; Royalty Enforcement; Status; Trigger Date,CU-1; D,75000,0,0,75000
2025-06-10T22:02:52,rdt-nmdws.json,Amount; Clause Violated; Default Triggered; Gamerdudee; Record Link; Royalty Enforcement; Status; Trigger Date,CU-1; D,75000,0,0,75000
2025-06-10T22:02:52,rdt-nmdws.json,Clause Violated; Default Triggered; Gamerdudee; Record Link; Royalty Enforcement; Status; Trigger Date,CU-1; D,75000,0,0,75000
2025-06-10T22:02:52,README.md,Clause; Core Features; Public,CU-1.4; CU-2.2; CU-2.3; G-4; G-7,175000,0,0,175000
2025-06-10T22:02:52,README.md,Clause; Declaratory; Institutional; Public,CU-1.4; CU-2.2; CU-2.3; D; G-4; G-7,175000,0,0,175000
2025-06-10T22:02:52,README.md,Declaratory; Institutional; Public,D; G-4; G-7,25000,0,0,25000
2025-06-10T22:02:52,README.md,Clause; Function; Mirror Default Clause; Royalty Enforcement Clause; Structural Default Clause,CU-1.4; CU-2.2; CU-2.3; D,150000,0,0,150000
2025-06-10T22:02:52,README.md,Mirror Default Clause; Royalty Enforcement Clause; Structural Default Clause; System Restriction,CU-1.4; CU-2.2; CU-2.3; D; G-4,150000,0,0,150000
2025-06-10T22:02:52,README.md,Legal Simulation Protocol; Mirror Default Clause; Royalty Enforcement Clause; Structural Default Clause; System Restriction,CU-1.4; CU-2.2; CU-2.3; D; G-4; G-5,150000,0,0,150000
2025-06-10T22:02:52,README.md,Declaratory; Legal Simulation Protocol; Mirror Default Clause; Protection; Structural Default Clause; System Restriction,CU-2.2; CU-2.3; D; G-4; G-5; G-6,50000,0,0,50000
2025-06-10T22:02:52,README.md,Declaratory; Legal Simulation Protocol; Mirror Default Clause; Procedural Sovereignty Enforcement; Protection; System Restriction,CU-2.3; D; G-4; G-5; G-6; G-7,75000,0,0,75000
2025-06-10T22:02:52,README.md,Declaratory; Legal Simulation Protocol; Procedural Sovereignty Enforcement; Protection; System Restriction,D; G-4; G-5; G-6; G-7,75000,0,0,75000
2025-06-10T22:02:52,README.md,Declaratory; Legal Simulation Protocol; Procedural Sovereignty Enforcement; Protection,D; G-5; G-6; G-7,75000,0,0,75000
2025-06-10T22:02:52,README.md,Any; Fee; This; Use Case,CU-1.4,150000,0,0,150000
2025-06-10T22:02:52,README.md,Autonomous Structural Enforcement; Created; Doctrine; Governed; Includes; Publicly; Restatement; Triggers,CU-1.4; D,150000,0,0,150000
2025-06-10T22:02:52,README.md,Autonomous Structural Enforcement; Doctrine; Governed; Includes; Publicly,CU-1.4; D,150000,0,0,150000
2025-06-10T22:02:52,README.md,Default Declared May; Instacart; Maplebear Inc; Public Default Enforcement; Total Due; Triggers,CU-1.4; CU-2.2; CU-2.3; D; G-4; G-7,175000,0,0,175000
2025-06-10T22:02:52,README.md,Declared; Default Declared May; Facebook; Instacart; Maplebear Inc; Total Due; Triggers,CU-1.4; CU-2.2; CU-2.3; D; G-4; G-7,175000,0,0,175000
2025-06-10T22:02:52,README.md,Declared; Default Declared May; Facebook; Instacart; Maplebear Inc; Total Due; Triggers,CU-1.4; CU-2.2; CU-2.3; D; G-4; G-7,175000,0,0,175000
2025-06-10T22:02:52,README.md,Declared; Default Declared May; Facebook; Total Due; Triggers,CU-1.4; CU-2.2; CU-2.3; D; G-4; G-7,175000,0,0,175000
2025-06-10T22:02:52,README.md,Declared; Default Declared May; Facebook; Total Due; Triggers,AF; BE; BP; CU-1.4; CU-2.2; CU-2.3; D,225000,0,0,225000
2025-06-10T22:02:52,README.md,Declared; Default Declared May; Total Due; Triggers,AF; BE; BP; CU-1.4; CU-2.2; CU-2.3; D,225000,0,0,225000
2025-06-10T22:02:52,README.md,Declared; Default Declared May; Total Due; Triggers,AF; BE; BP; CU-1.4; CU-2.2; CU-2.3; D,225000,0,0,225000
2025-06-10T22:02:52,README.md,Declared; Total Due; Triggers,AF; BE; BP; CU-1.4; CU-2.2; CU-2.3; D,225000,0,0,225000
2025-06-10T22:02:52,README.md,Clause; Clauses; Gaslighting Inversion Trigger; Inquiry; Retaliation; Unlicensed Inquiry,AF,75000,0,0,75000
2025-06-10T22:02:52,README.md,All; Clause; Engagement; Terms; Time,CU-1.4,150000,0,0,150000
2025-06-10T22:02:52,README.md,"Bound; Clause; Holmes

Any; Mr",AF; G-6,125000,0,0,125000
2025-06-10T22:02:52,RELEASE-NOTES-v1.0-license-locked.md,Affidavit Enforcement Provision; Clause; Government Conditional Waiver; Licensing Trigger; Recursive Penalties,CU-1.4,150000,0,0,150000
