timestamp,file,entities,clauses,base,escalation,days,total
2025-06-10T21:55:05,README-SIGNED-HEM.md,Attachment; Copy Possession Registry; Document Version; Email Submission; Entity; Filing; Notes; Possession Method,D,0,0,0,0
2025-06-10T21:55:05,README-SIGNED-HEM.md,Attachment; Author; Declaratory Structure; Document Version; Email Submission; Entity; Filing; Holmes; Immutable; Internal; License Files; Local; Master Copy; Mr; No; Notes; Possession Method; Private; Repository; Set; Signed,D,0,0,0,0
2025-06-10T21:55:05,README-SIGNED-HEM.md,Attachment; Author; Declaratory Structure; Email Submission; Filing; Holmes; Immutable; Internal; License Files; Local; Master Copy; Mr; No; Private; Repository; Set; Signed,D,0,0,0,0
2025-06-10T21:55:05,README-SIGNED-HEM.md,"Attachment; Declaration Statement

This; Holmes Enforcement Model",D,0,0,0,0
2025-06-10T21:55:05,README-SIGNED-HEM.md,Any; Attachment; Clauses; Holmes Enforcement Model; Signed; Subject,BE; D,0,0,0,0
2025-06-10T21:55:05,README-SIGNED-HEM.md,"Date; Holmes
Declaratory Author; Holmes Enforcement Model; Mr; Signed",D,0,0,0,0
2025-06-10T21:55:05,README-SIGNED-HEM.md,"Date; Holmes
Declaratory Author; Holmes Enforcement Model; Mr",D,0,0,0,0
2025-06-10T21:55:05,README.md,Author; Autonomous Structural Enforcement; Declaratory Royalty License; Doctrine; Engine; Holmes; License; Mr; Publicly Mirrored Enforcement; Sector; See; Status,D,0,0,0,0
2025-06-10T21:55:05,README.md,Author; Autonomous Structural Enforcement; Declaratory Royalty License; Doctrine; Engine; Holmes; License; Mr; New Mexico; Original Filing; Publicly Mirrored Enforcement; Sector; See; Status; Wage Claim,D,0,0,0,0
2025-06-10T21:55:05,README.md,Affidavit; Archive; Authorship; Autonomous Structural Enforcement; Doctrine; Engine; New Mexico; Original Filing; Public Affidavit; Publicly Mirrored Enforcement; Sector; Status; Wage Claim,D,0,0,0,0
2025-06-10T21:55:05,README.md,Clause; Core Features; Public,CU-1.4; CU-2.2; CU-2.3; G-4; G-7,175000,0,0,175000
2025-06-10T21:55:05,README.md,Clause; Declaratory; Institutional; Public,CU-1.4; CU-2.2; CU-2.3; D; G-4; G-7,175000,0,0,175000
2025-06-10T21:55:05,README.md,Declaratory; Institutional; Public,D; G-4; G-7,25000,0,0,25000
2025-06-10T21:55:05,README.md,Clause; Function; Mirror Default Clause; Royalty Enforcement Clause; Structural Default Clause,CU-1.4; CU-2.2; CU-2.3; D,150000,0,0,150000
2025-06-10T21:55:05,README.md,Mirror Default Clause; Royalty Enforcement Clause; Structural Default Clause; System Restriction,CU-1.4; CU-2.2; CU-2.3; D; G-4,150000,0,0,150000
2025-06-10T21:55:05,README.md,Legal Simulation Protocol; Mirror Default Clause; Royalty Enforcement Clause; Structural Default Clause; System Restriction,CU-1.4; CU-2.2; CU-2.3; D; G-4; G-5,150000,0,0,150000
2025-06-10T21:55:05,README.md,Declaratory; Legal Simulation Protocol; Mirror Default Clause; Protection; Structural Default Clause; System Restriction,CU-2.2; CU-2.3; D; G-4; G-5; G-6,50000,0,0,50000
2025-06-10T21:55:05,README.md,Declaratory; Legal Simulation Protocol; Mirror Default Clause; Procedural Sovereignty Enforcement; Protection; System Restriction,CU-2.3; D; G-4; G-5; G-6; G-7,75000,0,0,75000
2025-06-10T21:55:05,README.md,Declaratory; Legal Simulation Protocol; Procedural Sovereignty Enforcement; Protection; System Restriction,D; G-4; G-5; G-6; G-7,75000,0,0,75000
2025-06-10T21:55:05,README.md,Declaratory; Legal Simulation Protocol; Procedural Sovereignty Enforcement; Protection,D; G-5; G-6; G-7,75000,0,0,75000
2025-06-10T21:55:05,README.md,Ethical; Risk Disclosure; This,D,0,0,0,0
2025-06-10T21:55:05,README.md,Any; Fee; This; Use Case,CU-1.4,150000,0,0,150000
2025-06-10T21:55:05,README.md,Default; Legal Simulation Training; Mirroring; See; Silence; Structural Adoption,CU-2.2; D,0,0,0,0
2025-06-10T21:55:05,README.md,Attachment; Declaratory; Proof; Redacted; Royalty; Structural Summary; Use,D,0,0,0,0
2025-06-10T21:55:05,README.md,All; Demand; Enforceable; Historical; Instacart; Nmdws; Royalty,D,0,0,0,0
2025-06-10T21:55:05,README.md,All; Declaratory; Demand; Enforceable; Instacart; Nmdws; Royalty,D,0,0,0,0
2025-06-10T21:55:05,README.md,Declaratory; Demand; Enforceable; Instacart; Nmdws; Royalty,D,0,0,0,0
2025-06-10T21:55:05,README.md,Declaratory; Demand; Instacart; Royalty,D,0,0,0,0
2025-06-10T21:55:05,README.md,Autonomous Structural Enforcement; Created; Doctrine; Governed; Includes; Publicly; Restatement; Triggers,CU-1.4; D,150000,0,0,150000
2025-06-10T21:55:05,README.md,Autonomous Structural Enforcement; Doctrine; Governed; Includes; Publicly,CU-1.4; D,150000,0,0,150000
2025-06-10T21:55:05,README.md,Distribution Breach; Instacart Derivative Invoice; Liability Notices,D,0,0,0,0
2025-06-10T21:55:05,README.md,Distribution Breach; Instacart Derivative Invoice,D,0,0,0,0
2025-06-10T21:55:05,README.md,Existential Legal Risk; Full Disclosure,D,0,0,0,0
2025-06-10T21:55:05,README.md,Date Archived; June; Official Archive Snapshot; Procedurally; Status,D,0,0,0,0
2025-06-10T21:55:05,README.md,Declaration; Holmes; Holmes Enforcement Model; May; Mr; Public Mirror,D,0,0,0,0
2025-06-10T21:55:05,README.md,Gamerdudee; Holmes; Holmes Enforcement Model; Invoice; May; Mr; View Public Declaration,D,0,0,0,0
2025-06-10T21:55:05,README.md,Affidavit; Declaration; Invoice; May,D,0,0,0,0
2025-06-10T21:55:05,README.md,Default Declared May; Instacart; Maplebear Inc; Public Default Enforcement,D,0,0,0,0
2025-06-10T21:55:05,README.md,Default Declared May; Instacart; Maplebear Inc; Public Default Enforcement; Total Due; Triggers,CU-1.4; CU-2.2; CU-2.3; D; G-4; G-7,175000,0,0,175000
2025-06-10T21:55:05,README.md,Declared; Default Declared May; Facebook; Instacart; Maplebear Inc; Total Due; Triggers,CU-1.4; CU-2.2; CU-2.3; D; G-4; G-7,175000,0,0,175000
2025-06-10T21:55:05,README.md,Declared; Default Declared May; Facebook; Instacart; Maplebear Inc; Total Due; Triggers,CU-1.4; CU-2.2; CU-2.3; D; G-4; G-7,175000,0,0,175000
2025-06-10T21:55:05,README.md,Declared; Default Declared May; Facebook; Total Due; Triggers,CU-1.4; CU-2.2; CU-2.3; D; G-4; G-7,175000,0,0,175000
2025-06-10T21:55:05,README.md,Declared; Default Declared May; Facebook; Total Due; Triggers,AF; BE; BP; CU-1.4; CU-2.2; CU-2.3; D,225000,0,0,225000
2025-06-10T21:55:05,README.md,Declared; Default Declared May; Total Due; Triggers,AF; BE; BP; CU-1.4; CU-2.2; CU-2.3; D,225000,0,0,225000
2025-06-10T21:55:05,README.md,Declared; Default Declared May; Total Due; Triggers,AF; BE; BP; CU-1.4; CU-2.2; CU-2.3; D,225000,0,0,225000
2025-06-10T21:55:05,README.md,Declared; Total Due; Triggers,AF; BE; BP; CU-1.4; CU-2.2; CU-2.3; D,225000,0,0,225000
2025-06-10T21:55:05,README.md,"Holmes; May; Mr; Notice
Date Posted; Reference Case; Structural Inquiry Boundary; Submitted By",D,0,0,0,0
2025-06-10T21:55:05,README.md,Clause; Clauses; Derivative Use; These; Unlicensed Inquiry,D,0,0,0,0
2025-06-10T21:55:05,README.md,Clause; Clauses; Gaslighting Inversion Trigger; Inquiry; Retaliation; Unlicensed Inquiry,AF,75000,0,0,75000
2025-06-10T21:55:05,README.md,All; Clause; Engagement; Terms; Time,CU-1.4,150000,0,0,150000
2025-06-10T21:55:05,README.md,Clause; Holmes; Mr; Refusal; Time,BP,0,0,0,0
2025-06-10T21:55:05,README.md,Declaratory Lineage Notice; Heritage Clause; Holmes; Mr,D,0,0,0,0
2025-06-10T21:55:05,README.md,"Bound; Clause; Holmes

Any; Mr",AF; G-6,125000,0,0,125000
2025-06-10T21:55:05,README.md,Declaratory Contact; Holmes; Mr,D,0,0,0,0
2025-06-10T21:55:05,README.md,Declaratory Sovereign; Gamerdudee; Holmes; Holmes Enforcement Model; Mr; Repo,D,0,0,0,0
2025-06-10T21:55:05,RELEASE-NOTES-v1.0-license-locked.md,This,D,0,0,0,0
2025-06-10T21:55:05,RELEASE-NOTES-v1.0-license-locked.md,Affidavit Enforcement Provision; Clause; Government Conditional Waiver; Licensing Trigger; Recursive Penalties,CU-1.4,150000,0,0,150000
2025-06-10T21:55:05,royalty-model-and-declaratory-IP.md,Declaratory Intellectual Property; Model; Royalty Model; The Holmes Enforcement; Unlike,D,0,0,0,0
2025-06-10T21:55:05,royalty-model-and-declaratory-IP.md,Declaratory Intellectual Property; Model; Royalty Model; The Holmes Enforcement; Unlike,D,0,0,0,0
2025-06-10T21:55:05,royalty-model-and-declaratory-IP.md,Intellectual Property; Under; What Is Declaratory,D,0,0,0,0
2025-06-10T21:55:05,royalty-model-and-declaratory-IP.md,Intellectual Property; Investigatory; Under; What Is Declaratory,D,0,0,0,0
2025-06-10T21:55:05,royalty-model-and-declaratory-IP.md,Clause,D,0,0,0,0
2025-06-10T21:55:05,royalty-model-and-declaratory-IP.md,Act; Defend Trade Secrets; Lanham Act,D,0,0,0,0
2025-06-10T21:55:05,royalty-model-and-declaratory-IP.md,Declaratory Judgment; Lanham Act; Quantum Meruit Doctrine; Restatement; Restitution,D,0,0,0,0
2025-06-10T21:55:05,royalty-model-and-declaratory-IP.md,Declaratory Judgment; Quantum Meruit Doctrine; Restatement; Restitution,D,0,0,0,0
2025-06-10T21:55:05,royalty-model-and-declaratory-IP.md,Clause; Enforcement Effect; Failure; Procedural; Reuse,CU-1.4; CU-2.2; CU-2.3,150000,0,0,150000
2025-06-10T21:55:05,royalty-model-and-declaratory-IP.md,Declaratory; Failure; Procedural; Protection; Reuse,CU-1.4; CU-2.2; CU-2.3; D; G-6,200000,0,0,200000
2025-06-10T21:55:05,royalty-model-and-declaratory-IP.md,Declaratory; Failure; Procedural; Procedural Sovereignty Enforcement; Protection; Reuse,CU-1.4; CU-2.2; CU-2.3; D; G-6; G-7,225000,0,0,225000
2025-06-10T21:55:05,royalty-model-and-declaratory-IP.md,Declaratory; Failure; Procedural; Procedural Sovereignty Enforcement; Protection; Royalty,CU-2.2; CU-2.3; D; G-6; G-7,75000,0,0,75000
2025-06-10T21:55:05,royalty-model-and-declaratory-IP.md,Autonomous; Declaratory; Failure; Procedural Sovereignty Enforcement; Protection; Royalty,CU-2.3; D; G-6; G-7,75000,0,0,75000
2025-06-10T21:55:05,royalty-model-and-declaratory-IP.md,Denying; Failing; Ignoring; Using,D,0,0,0,0
2025-06-10T21:55:05,royalty-model-and-declaratory-IP.md,Debt; Derivation; Enforcement; Failing; License; Silence; Use,D,0,0,0,0
2025-06-10T21:55:05,royalty-model-and-declaratory-IP.md,Government Policy; Inference; Internal Policy Replication; Logic; Post; Retroactive Licensing; Shadow Derivation; Silent; Structural,D,0,0,0,0
2025-06-10T21:55:05,royalty-model-and-declaratory-IP.md,Declaratory Enforcement; Design; Enforcement; It,D,0,0,0,0
2025-06-10T21:55:05,royalty-model-and-declaratory-IP.md,Application; Doctrine; Legal Grounds; Royalty Enforcement; Statute,D,0,0,0,0
2025-06-10T21:55:05,royalty-model-and-declaratory-IP.md,Application; Declaratory; Doctrine; Legal Grounds; Royalty Enforcement; Statute,D,0,0,0,0
2025-06-10T21:55:05,royalty-model-and-declaratory-IP.md,Application; Contracts; Declaratory; Doctrine; Enforcement; Restatement; Silence; Statute,D,0,0,0,0
2025-06-10T21:55:05,royalty-model-and-declaratory-IP.md,Contract; Derivative; Enforcement; False; Lanham Act; Restatement; Restitution; Value,D,0,0,0,0
2025-06-10T21:55:05,royalty-model-and-declaratory-IP.md,"Declaratory License; Payment Instructions

To",D,0,0,0,0
2025-06-10T21:55:05,royalty-model-and-declaratory-IP.md,Default; Final Clause Reminder; Per Clause,CU-1.4; D,150000,0,0,150000
2025-06-10T21:55:05,royalty-model-and-declaratory-IP.md,Default; Enforcement; Per Clause,CU-1.4; D,150000,0,0,150000
2025-06-10T21:55:05,royalty-model-and-declaratory-IP.md,Derivative; Enforcement; Mandatory,D,0,0,0,0
2025-06-10T21:55:05,Royalty-Schedule-HEM.md,Academic Use; Advocacy; Agency Policy; Arbitration Platform; Free; Gov; Inclusion; Nonprofit Derivation; Public Defense Rider; Use,D,0,0,0,0
2025-06-10T21:55:05,Royalty-Schedule-HEM.md,Academic Use; Advocacy; Agency Policy; Free; Gov; Inclusion; Nonprofit Derivation; Public Defense Rider,D,0,0,0,0
2025-06-10T21:55:05,NMDWS-Extension-Approval.md,Date Approved; Extension Approval; May; Record,D,0,0,0,0
2025-06-10T21:55:05,NMDWS-Extension-Approval.md,Agency; Case No; Date Approved; Extension Approval; May; New Mexico Department; Record; Workforce Solutions,D,0,0,0,0
2025-06-10T21:55:05,NMDWS-Extension-Approval.md,Agency; Case No; Date Approved; Filed By; Holmes; May; Mr; New Mexico Department; Workforce Solutions,D,0,0,0,0
2025-06-10T21:55:05,NMDWS-Extension-Approval.md,Holmes Enforcement Model; Instacart; June; Summary; This,D,0,0,0,0
2025-06-10T21:55:05,NMDWS-Extension-Approval.md,Beneficiary Clause; Clause; Estate; Heirs; Licensing; Possession; Refusal Conversion; Systemwide Precedent Lock,BE; BP,0,0,0,0
2025-06-10T21:55:05,NMDWS-Extension-Approval.md,Beneficiary Clause; Clause; Estate; Heirs; Licensing; Possession; Refusal Conversion; Systemwide Precedent Lock,BE; BP,0,0,0,0
2025-06-10T21:55:05,NMDWS-Extension-Approval.md,Any; Declaratory; June; Public; Referenced Filing,D,0,0,0,0
2025-06-10T21:55:05,CU-series-clauses.md,"Activation; Clause; Declaratory Autonomy; Executing Compensation
Title; Holmes Enforcement Model; Procedural Sovereignty; Royalty Enforcement
Trigger; Self; These",CU-2.2; CU-2.3; CU-6; D,0,0,0,0
2025-06-10T21:55:05,CU-series-clauses.md,"Activation; Clause; Declaratory Autonomy; Executing Compensation
Title; Procedural Sovereignty; Royalty Enforcement
Trigger; Self",CU-2.2; CU-2.3; CU-6; D,0,0,0,0
2025-06-10T21:55:05,CU-series-clauses.md,"Activation; Clause; Declaratory Autonomy; Effect; Executing Compensation
Title; Procedural Sovereignty; Royalty Enforcement
Trigger; Self",CU-2.2; CU-2.3; CU-6; D,0,0,0,0
2025-06-10T21:55:05,CU-series-clauses.md,Effect; Once; This,CU-6,0,0,0,0
2025-06-10T21:55:05,CU-series-clauses.md,Clause; Default; Delay; Escalation Clause; Public; Retroactive Immunity Rejection; Silence,CU-7; D,0,0,0,0
2025-06-10T21:55:05,CU-series-clauses.md,"Any; Clause; Default; Delay; Escalation Clause
Title; Immunity Denial
Trigger; Rebuttal Deadline Finality; Retroactive Immunity Rejection; Silence",CU-7; D,0,0,0,0
2025-06-10T21:55:05,CU-series-clauses.md,"Any; Clause; Escalation Clause
Title; Immunity Denial
Trigger; Rebuttal Deadline Finality; Retroactive Immunity Rejection",CU-7; D,0,0,0,0
2025-06-10T21:55:05,CU-series-clauses.md,Clause; Penalty; Precedent Lock; Publicly; Retaliatory Action; Structure; Triggers,AF; BP,75000,0,0,75000
2025-06-10T21:55:05,G-series-structural-governance.md,Clause; Derived System Restriction; No,D; G-4,0,0,0,0
2025-06-10T21:55:05,G-series-structural-governance.md,Clause; No; Replication,CU-1.4,150000,0,0,150000
2025-06-10T21:55:05,G-series-structural-governance.md,"Clause; Legal Simulation Protocol; Recognition

This",G-5,0,0,0,0
2025-06-10T21:55:05,G-series-structural-governance.md,"Clause; Declaratory Intellectual Property; Holmes Enforcement Model; Protection

All",D; G-6,50000,0,0,50000
2025-06-10T21:55:05,G-series-structural-governance.md,"Clause; Clauses; Declaratory Intellectual Property; Holmes Enforcement Model; Protection

All; Use",CU-1.4; CU-2.1; D; G-6,210000,0,0,210000
2025-06-10T21:55:05,G-series-structural-governance.md,All; Clauses; Declaratory Intellectual Property; Holmes Enforcement Model; Use,CU-1.4; CU-2.1; D,160000,0,0,160000
2025-06-10T21:55:05,G-series-structural-governance.md,Clause; Model; Sovereign Procedural Supremacy; The Holmes Enforcement,G-7,25000,0,0,25000
2025-06-10T21:55:05,G-series-structural-governance.md,Any; Clause; Infrastructure Sovereignty Clause,G-8,0,0,0,0
2025-06-10T21:55:05,G-series-structural-governance.md,Any; Cloud; Data; Supercomputing,D,0,0,0,0
2025-06-10T21:55:05,G-series-structural-governance.md,Deployment; Simulated; This; Unlicensed,D,0,0,0,0
2025-06-10T21:55:05,G-series-structural-governance.md,Clause; Confirmation; Declaratory; Ignorance; Procedural Sovereignty; Protection; Royalty Enforcement,BP; D,0,0,0,0
2025-06-10T21:55:05,G-series-structural-governance.md,All; Clause; Confirmation; Declaratory; Ignorance; Procedural Sovereignty; Protection,BP; D,0,0,0,0
2025-06-10T21:55:05,G-series-structural-governance.md,All; Clause; Effect,G-8,0,0,0,0
2025-06-10T21:55:05,G-series-structural-governance.md,Clause; Executing Compensation; Holmes Enforcement Model; Procedural Sovereignty; Self; These; Title,CU-6,0,0,0,0
2025-06-10T21:55:05,G-series-structural-governance.md,Declaratory Autonomy; Royalty Enforcement; Title; Trigger,D,0,0,0,0
2025-06-10T21:55:05,G-series-structural-governance.md,Activation; Effect; Trigger,CU-2.2; CU-2.3,0,0,0,0
2025-06-10T21:55:05,G-series-structural-governance.md,Effect; Once; This,CU-6,0,0,0,0
2025-06-10T21:55:05,G-series-structural-governance.md,Clause; Default; Delay; Escalation Clause; Public; Retroactive Immunity Rejection; Silence,CU-7; D,0,0,0,0
2025-06-10T21:55:05,G-series-structural-governance.md,Clause; Default; Delay; Escalation Clause; Retroactive Immunity Rejection; Silence; Title,CU-7; D,0,0,0,0
2025-06-10T21:55:05,G-series-structural-governance.md,Immunity Denial; Rebuttal Deadline Finality; Title; Trigger,D,0,0,0,0
2025-06-10T21:55:05,G-series-structural-governance.md,Clause; Penalty; Precedent Lock; Publicly; Retaliatory Action; Structure; Triggers,AF; BP,75000,0,0,75000
2025-06-10T21:55:05,heritage-clause.md,Declaratory Lineage Notice; Document Type; Heritage Clause; Supplemental Declaratory Record,D,0,0,0,0
2025-06-10T21:55:05,heritage-clause.md,Author; Declaratory Lineage Notice; Document Type; Gamerdudee; Heritage Clause; Holmes; Holmes Enforcement Model; Mr; Repository; Supplemental Declaratory Record,D,0,0,0,0
2025-06-10T21:55:05,heritage-clause.md,And; Ann Whiteside; Genealogical; Philip; Philip Washington Singleton; Singleton,D,0,0,0,0
2025-06-10T21:55:05,heritage-clause.md,Boundary Reversal Enforcement; Clause; Declaratory; Inquiry; Misrepresentation; Protection; Retaliation,AF; BP; D; G-6,125000,0,0,125000
2025-06-10T21:55:05,heritage-clause.md,Boundary Reversal Enforcement; Clause; Declaratory; Inquiry; Misrepresentation; Protection; Retaliation,AF; BP; D; G-6,125000,0,0,125000
2025-06-10T21:55:05,heritage-clause.md,Boundary Reversal Enforcement; Clause; Declaratory; Inquiry; Misrepresentation; Protection; Retaliation,AF; BP; D; G-6,125000,0,0,125000
2025-06-10T21:55:05,heritage-clause.md,"Gamerdudee; Holmes  
Declaratory Author; Holmes Enforcement Model; Mr; Signed",D,0,0,0,0
2025-06-10T21:55:05,attachment-a-structural-summary.md,"Attachment; Declaratory Enforcement
Title; Derivative Use Protections; Fee Recovery
Submitted; Intellectual Rights; Investigatory Labor; New Mexico Department; Structural Summary; To; Workforce Solutions",D,0,0,0,0
2025-06-10T21:55:05,attachment-a-structural-summary.md,"Attachment; Case No; Declaratory Enforcement
Title; Derivative Use Protections; Fee Recovery
Submitted; Intellectual Rights; Investigatory Labor; New Mexico Department; Structural Summary; To; Workforce Solutions",D,0,0,0,0
2025-06-10T21:55:05,attachment-a-structural-summary.md,"Attachment; Case No; Date Filed; Declaratory Enforcement
Title; Derivative Use Protections; Fee Recovery
Submitted; Intellectual Rights; Investigatory Labor; May; New Mexico Department; Structural Summary; To; Workforce Solutions",D,0,0,0,0
2025-06-10T21:55:05,attachment-a-structural-summary.md,"Author; Case No; Date Filed; Holmes
License Reference; Holmes Enforcement Model; May; Mr; New Mexico Department; Submitted To; Workforce Solutions",D,0,0,0,0
2025-06-10T21:55:05,attachment-a-structural-summary.md,"Author; Declaratory Purpose; Enforcement Clauses; Holmes
License Reference; Holmes Enforcement Model; Mr",CU-1.4; CU-2.2; CU-2.3; D; G-4; G-7,175000,0,0,175000
2025-06-10T21:55:05,attachment-a-structural-summary.md,"Declaratory Purpose
This; Enforcement Clauses; Holmes Enforcement Model; Submitted",CU-1.4; CU-2.2; CU-2.3; D; G-4; G-7,175000,0,0,175000
2025-06-10T21:55:05,attachment-a-structural-summary.md,"Clause; Core Functions
Section; Declaratory Licensing Scope; Declares; Fee Recovery	Outlines; Royalty Enforcement; Title	Function; Trigger Mapping	Links",CU-1.4; D,150000,0,0,150000
2025-06-10T21:55:05,attachment-a-structural-summary.md,Admission Clause	Defines; Clause; Declaratory Licensing Scope; Declares; Derivative Use; Fee Recovery	Outlines; Linked Enforcement Enhancer; Royalty Enforcement; Silence; States; Trigger Mapping	Links,CU-1.4; D,150000,0,0,150000
2025-06-10T21:55:05,attachment-a-structural-summary.md,Admission Clause	Defines; Consent Clause	Any; Defensive Action; Derivative Use; Fee Recovery	Outlines; Jurisdictional Containment Clause; Linked Enforcement Enhancer; Prevents; Royalty Enforcement; Silence; States,CU-1.4; D,150000,0,0,150000
2025-06-10T21:55:05,attachment-a-structural-summary.md,Admission Clause	Defines; Consent Clause	Any; Defensive Action; Derivative Use; Jurisdictional Containment Clause; Linked Enforcement Enhancer; Prevents; Public Trigger Default; Silence; States; Structural,D,0,0,0,0
2025-06-10T21:55:05,attachment-a-structural-summary.md,Consent Clause	Any; Defensive Action; Jurisdictional Containment Clause; Prevents; Public Trigger Default; Structural; Timeline Summary,D,0,0,0,0
2025-06-10T21:55:05,attachment-a-structural-summary.md,"Archive; Filed; May; Public; Timeline Summary
May",D,0,0,0,0
2025-06-10T21:55:05,attachment-a-structural-summary.md,Case; Default; May; Phone,CU-2.3; D,0,0,0,0
2025-06-10T21:55:05,attachment-a-structural-summary.md,All; Case; Default; June; May,CU-1.4; CU-2.3; D,150000,0,0,150000
2025-06-10T21:55:05,attachment-a-structural-summary.md,All; Default; Enforcement Clauses Activated; June; May,CU-1.4; D,150000,0,0,150000
2025-06-10T21:55:05,attachment-a-structural-summary.md,Enforcement Clauses Activated; Procedural Default; Royalty Enforcement Trigger; Silence,CU-1.4; CU-2.2; D,150000,0,0,150000
2025-06-10T21:55:05,attachment-a-structural-summary.md,Mirror Clause Violation; Procedural Default; Royalty Enforcement Trigger; Silence,CU-1.4; CU-2.2; CU-2.3; D,150000,0,0,150000
2025-06-10T21:55:05,attachment-a-structural-summary.md,Disregard Protections; Mirror Clause Violation; Participation; Procedural Default; Silence,CU-2.2; CU-2.3; CU-3; CU-4; D,105000,0,0,105000
2025-06-10T21:55:05,attachment-a-structural-summary.md,Containment Logic; Declaratory; Disregard Protections; Governance; Mirror Clause Violation; Participation,CU-2.3; CU-3; CU-4; D; G-4; G-7,130000,0,0,130000
2025-06-10T21:55:05,attachment-a-structural-summary.md,Containment Logic; Declaratory; Disregard Protections; Governance; Participation; Redacted Content,CU-3; CU-4; D; G-4; G-7,130000,0,0,130000
2025-06-10T21:55:05,authorship-declaration.md,Authorship Declaration; Holmes; Holmes Enforcement Model; Mr; Name,D,0,0,0,0
2025-06-10T21:55:05,authorship-declaration.md,Completion; Date; Days; Gamerdudee; Holmes; May; Mr; Name; Origin; Public Mirror; Time,D,0,0,0,0
2025-06-10T21:55:05,authorship-declaration.md,Completion; Date; Days; Gamerdudee; Holmes; May; Mr; Name; Origin; Public Mirror; Time,D,0,0,0,0
2025-06-10T21:55:05,authorship-declaration.md,Co; Conceptualized; Designed; Holmes; Mr; Publicly,D,0,0,0,0
2025-06-10T21:55:05,authorship-declaration.md,Autonomous Structural Enforcement; Doctrine; Holmes; Issue; Mr; This,D,0,0,0,0
2025-06-10T21:55:05,authorship-declaration.md,Author; Declaratory Identity; Holmes; Mr; Record,D,0,0,0,0
2025-06-10T21:55:05,authorship-declaration.md,Declaratory Sovereign; Email; Gamerdudee; Holmes; Mr; Procedural Author; Repository,D,0,0,0,0
2025-06-10T21:55:05,authorship-declaration.md,Declaratory Lineage Notice; Heritage Clause; Holmes; Mr,D,0,0,0,0
2025-06-10T21:55:05,authorship-declaration.md,Bloodline; Direct; Native American; Philip Washington Singleton; Republic; Richard Singleton Sr; Texas; This,D,0,0,0,0
2025-06-10T21:55:05,authorship-declaration.md,Any; Clause; Inquiry; Jurisdictional Misrepresentation; Legally; Retaliation,AF; G-6,125000,0,0,125000
2025-06-10T21:55:05,declaratory-entity-immunities.md,Author; Declaratory Entity Immunities; Enforcement Protections; Holmes; Mr,D,0,0,0,0
2025-06-10T21:55:05,declaratory-entity-immunities.md,Clauses Referenced; Declared Origin Date; Enforcement System; Gamerdudee; Holmes Enforcement Model; May; Public Mirror,CU-1.4; D; G-4; G-5; G-6; G-7,225000,0,0,225000
2025-06-10T21:55:05,declaratory-entity-immunities.md,Clauses Referenced; Declared Origin Date; Gamerdudee; May; Public Mirror,CU-1.4; D; G-4; G-5; G-6; G-7,225000,0,0,225000
2025-06-10T21:55:05,declaratory-entity-immunities.md,"Declaratory Sovereign Entity; Holmes; Holmes Enforcement Model; Mr; Purpose; This Document

This",D,0,0,0,0
2025-06-10T21:55:05,declaratory-entity-immunities.md,"Declaratory Sovereign Entity; Holmes; Holmes Enforcement Model; Mr; Purpose; This Document

This",D,0,0,0,0
2025-06-10T21:55:05,declaratory-entity-immunities.md,Clause; Legal Simulation Protocol; Recognition; Structural Immunity Clauses; This,G-5,0,0,0,0
2025-06-10T21:55:05,declaratory-entity-immunities.md,All; Clause; Declaratory; Protection,D; G-6,50000,0,0,50000
2025-06-10T21:55:05,declaratory-entity-immunities.md,All; Declaratory Intellectual Property; This,D,0,0,0,0
2025-06-10T21:55:05,declaratory-entity-immunities.md,Full; Interactions; Retaliation,D,0,0,0,0
2025-06-10T21:55:05,declaratory-entity-immunities.md,Clause; Sovereign Procedural Supremacy; This,G-7,25000,0,0,25000
2025-06-10T21:55:05,declaratory-entity-immunities.md,Clause; Declaring; Filing; Immune; Immunity Status; Risk,CU-1.4; D; G-5; G-7,175000,0,0,175000
2025-06-10T21:55:05,declaratory-entity-immunities.md,Billing; Declaring; Filing; Immune,CU-1.4; D; G-5; G-6; G-7,225000,0,0,225000
2025-06-10T21:55:05,declaratory-entity-immunities.md,Billing; Declaring; Filing; Immune; Submitting,CU-1.4; D; G-5; G-6; G-7,225000,0,0,225000
2025-06-10T21:55:05,declaratory-entity-immunities.md,Billing; Declaring; Filing; Immune; Refusing; Submitting,CU-1.4; D; G-5; G-6; G-7,225000,0,0,225000
2025-06-10T21:55:05,declaratory-entity-immunities.md,Billing; Declaring; Immune; Refusing; Submitting; Triggering,CU-1.4; D; G-5; G-6; G-7,225000,0,0,225000
2025-06-10T21:55:05,declaratory-entity-immunities.md,Billing; Immune; Refusing; Submitting; Triggering,CU-1.4; G-5; G-6; G-7,225000,0,0,225000
